### ISSUE TITLE
Error installing elasticsearch-kopf on 10.1.15

### ISSUE THREAD

**Issue by timolow** [rcbops/rpc-openstack#411]
Getting the following error on 10.1.15

TASK: [elasticsearch | Install Kopf Plugin] ***********************************
failed: [logger1_elasticsearch_container-c68f9351] => (item=lmenezes/elasticsearch-kopf) => {"changed": true, "cmd": ["./plugin", "-install", "lmenezes/elasticsearch-kopf"], "delta": "0:00:01.574572", "end": "2015-09-28 13:24:48.941217", "item": "lmenezes/elasticsearch-kopf", "rc": 74, "start": "2015-09-28 13:24:47.366645"}
stdout: -> Installing lmenezes/elasticsearch-kopf...
Trying https://github.com/lmenezes/elasticsearch-kopf/archive/master.zip...
Downloading .......................................................................................................................................................................................................................................................Failed to install lmenezes/elasticsearch-kopf, reason: failed to download out of all possible locations..., use -verbose to get detailed information

Question is does 'plugin' support redirect:

wget https://github.com/lmenezes/elasticsearch-kopf/archive/master.zip
--2015-09-28 13:47:20--  https://github.com/lmenezes/elasticsearch-kopf/archive/master.zip
Resolving github.com (github.com)... 192.30.252.128
Connecting to github.com (github.com)|192.30.252.128|:443... connected.
HTTP request sent, awaiting response... 302 Found
Location: https://codeload.github.com/lmenezes/elasticsearch-kopf/zip/master [following]
--2015-09-28 13:47:21--  https://codeload.github.com/lmenezes/elasticsearch-kopf/zip/master
Resolving codeload.github.com (codeload.github.com)... 192.30.252.144
Connecting to codeload.github.com (codeload.github.com)|192.30.252.144|:443... connected.
 

    FATAL: all hosts have already failed -- aborting

**Comment by claco** [comment]
This may or may not be related: https://github.com/elastic/elasticsearch/issues/1432

Might be able to just change the url being downloaded to:
```
https://codeload.github.com/lmenezes/elasticsearch-kopf/zip/master
```

**Comment by d34dh0r53** [comment]
Hi @timolow, are you behind a proxy while doing this?  According to the bug @claco linked the plugin code "should" follow 302s.

**Comment by timolow** [comment]
Howdy,

It appears the tcp-bypass I implemented earlier to bypass the github throttling caused some transit issues when using the "plugin" installer.  After removing tcp-bypass from the network Issues seemed to have gone away.

Tcpdump from the session:

18:43:46.497559 IP codeload.github.com.https > logger1.38756: Flags [.], seq 852045:853481, ack 504, win 17, length 1436
18:43:46.497595 IP logger1.38756 > codeload.github.com.https: Flags [R], seq 2351064223, win 0, length 0
18:43:46.497712 IP codeload.github.com.https > logger1.38756: Flags [.], seq 853481:854917, ack 504, win 17, length 1436
18:43:46.497733 IP logger1.38756 > codeload.github.com.https: Flags [R], seq 2351064223, win 0, length 0
18:43:46.497908 IP codeload.github.com.https > logger1.38756: Flags [.], seq 854917:857789, ack 504, win 17, length 2872
18:43:46.497932 IP logger1.38756 > codeload.github.com.https: Flags [R], seq 2351064223, win 0, length 0
18:43:46.498076 IP codeload.github.com.https > logger1.38756: Flags [.], seq 857789:860661, ack 504, win 17, length 2872
18:43:46.498106 IP logger1.38756 > codeload.github.com.https: Flags [R], seq 2351064223, win 0, length 0
18:43:46.498142 IP codeload.github.com.https > logger1.38756: Flags [.], seq 860661:863533, ack 504, win 17, length 2872
18:43:46.498244 IP logger1.38756 > codeload.github.com.https: Flags [R], seq 2351064223, win 0, length 0
18:43:46.498293 IP codeload.github.com.https > logger1.38756: Flags [.], seq 863533:867841, ack 504, win 17, length 4308
18:43:46.498385 IP logger1.38756 > codeload.github.com.https: Flags [R], seq 2351064223, win 0, length 0
18:43:46.498431 IP codeload.github.com.https > logger1.38756: Flags [.], seq 867841:872149, ack 504, win 17, length 4308
18:43:46.498517 IP logger1.38756 > codeload.github.com.https: Flags [R], seq 2351064223, win 0, length 0
18:43:46.498638 IP codeload.github.com.https > logger1.38756: Flags [.], seq 872149:875021, ack 504, win 17, length 2872
18:43:46.498656 IP logger1.38756 > codeload.github.com.https: Flags [R], seq 2351064223, win 0, length 0
18:43:46.498800 IP codeload.github.com.https > logger1.38756: Flags [.], seq 875021:880765, ack 504, win 17, length 5744
18:43:46.498822 IP logger1.38756 > codeload.github.com.https: Flags [R], seq 2351064223, win 0, length 0
18:43:46.498870 IP codeload.github.com.https > logger1.38756: Flags [.], seq 880765:882201, ack 504, win 17, length 1436
18:43:46.498955 IP logger1.38756 > codeload.github.com.https: Flags [R], seq 2351064223, win 0, length 0
18:43:46.498993 IP codeload.github.com.https > logger1.38756: Flags [.], seq 882201:883637, ack 504, win 17, length 1436
18:43:46.499016 IP logger1.38756 > codeload.github.com.https: Flags [R], seq 2351064223, win 0, length 0
18:43:46.499102 IP codeload.github.com.https > logger1.38756: Flags [.], seq 883637:885073, ack 504, win 17, length 1436
18:43:46.499120 IP logger1.38756 > codeload.github.com.https: Flags [R], seq 2351064223, win 0, length 0
18:43:46.499338 IP logger1.38756 > codeload.github.com.https: Flags [.], ack 837685, win 100, length 0
18:43:46.499390 IP codeload.github.com.https > logger1.38756: Flags [.], seq 885073:886509, ack 504, win 17, length 1436
18:43:46.499418 IP logger1.38756 > codeload.github.com.https: Flags [R], seq 2351064223, win 0, length 0
18:43:46.506368 IP logger1.38756 > codeload.github.com.https: Flags [.], ack 837685, win 312, length 0
18:43:46.510805 IP logger1.38756 > codeload.github.com.https: Flags [.], ack 837685, win 630, length 0
18:43:46.528149 IP logger1.38756 > codeload.github.com.https: Flags [.], ack 837685, win 1296, length 0
18:43:46.542753 IP codeload.github.com.https > logger1.38756: Flags [R], seq 4163418231, win 0, length 0
18:43:46.546871 IP codeload.github.com.https > logger1.38756: Flags [R], seq 4163418231, win 0, length 0
18:43:46.554513 IP codeload.github.com.https > logger1.38756: Flags [R], seq 4163418231, win 0, length 0
18:43:46.571365 IP codeload.github.com.https > logger1.38756: Flags [R], seq 4163418231, win 0, length 0
18:43:46.607577 IP logger1.58290 > github.com.https: Flags [R.], seq 495, ack 5414, win 346, length 0
